<?xml version="1.0" encoding="UTF-8"?>
<dataModel xmlns:xsi="http://www.w3.org/2001/XMLSchema-instance" xsi:noNamespaceSchemaLocation="db_model_vegbank_schema.xsd">
  <title/>
  <version/>
  <versionDesc/>
  <author/>
  <institution/>
  <contributor/>
  <description/>
  <date/>
  <entity>
    <entityName>cust_cvs_SoilDepth</entityName>
    <entitySummary>a list of soil Depths for each corner of intensively sampled modules</entitySummary>
    <entityDescription>a list of soil Depths for each corner of intensively sampled modules</entityDescription>
    <attribute>
      <attID>1</attID>
      <attName>corner</attName>
      <attModel>logical</attModel>
      <attNulls>yes</attNulls>
      <attType>varchar (4)</attType>
      <attKey>n/a</attKey>
      <attRelType type="n/a" name="n/a"/>
      <attReferences>n/a</attReferences>
      <attListType>no</attListType>
      <attList/>
      <attNotes>n/a</attNotes>
      <attDefinition>module number OR A=average depth, min=minimum, max=maximum</attDefinition>
    <update>2.0.0</update></attribute>
    <attribute>
      <attID>2</attID>
      <attName>depth</attName>
      <attModel>logical</attModel>
      <attNulls>yes</attNulls>
      <attType>Float</attType>
      <attKey>n/a</attKey>
      <attRelType type="n/a" name="n/a"/>
      <attReferences>n/a</attReferences>
      <attListType>no</attListType>
      <attList/>
      <attNotes>n/a</attNotes>
      <attDefinition>depth to impermeable layer in cm</attDefinition>
    <update>2.0.0</update></attribute>
    <attribute>
      <attID>3</attID>
      <attName>DepthID</attName>
      <attModel>logical</attModel>
      <attNulls>yes</attNulls>
      <attType>serial</attType>
      <attKey>n/a</attKey>
      <attRelType type="n/a" name="n/a"/>
      <attReferences>n/a</attReferences>
      <attListType>no</attListType>
      <attList/>
      <attNotes>n/a</attNotes>
      <attDefinition>sequential order of depths, unique key value</attDefinition>
    <update>2.0.0</update></attribute>
    <attribute>
      <attID>4</attID>
      <attName>module</attName>
      <attModel>logical</attModel>
      <attNulls>yes</attNulls>
      <attType>varchar (4)</attType>
      <attKey>n/a</attKey>
      <attRelType type="n/a" name="n/a"/>
      <attReferences>n/a</attReferences>
      <attListType>no</attListType>
      <attList/>
      <attNotes>n/a</attNotes>
      <attDefinition>module number OR A=average depth, min=minimum, max=maximum</attDefinition>
    <update>2.0.0</update></attribute>
    <attribute>
      <attID>5</attID>
      <attName>observation_ID</attName>
      <attModel>logical</attModel>
      <attNulls>yes</attNulls>
      <attType>Integer</attType>
      <attKey>FK</attKey>
      <attRelType type="n/a" name="n/a"/>
      <attReferences>observation.observation_ID</attReferences>
      <attListType>no</attListType>
      <attList/>
      <attNotes>n/a</attNotes>
      <attDefinition>link to observation</attDefinition>
    <update>2.0.0</update></attribute>
  </entity>
  <entity>
    <entityName>observation</entityName>
    <entitySummary>see VegBank</entitySummary>
    <entityDescription>see VegBank</entityDescription>
    <attribute>
      <attID>6</attID>
      <attName>cust_cvs_CanopyHeight</attName>
      <attLabel>Canopy Height in meters</attLabel>
      <attModel>logical</attModel>
      <attNulls>yes</attNulls>
      <attType>Float</attType>
      <attKey>n/a</attKey>
      <attRelType type="n/a" name="n/a"/>
      <attReferences>n/a</attReferences>
      <attListType>no</attListType>
      <attList/>
      <attNotes>n/a</attNotes>
      <attDefinition>Height of canopy vegetation in meters.</attDefinition>
    <update>2.0.0</update></attribute>
    <attribute>
      <attID>7</attID>
      <attName>cust_cvs_compassType</attName>
      <attLabel>Compass Type</attLabel>
      <attModel>logical</attModel>
      <attNulls>yes</attNulls>
      <attType>varchar (10)</attType>
      <attKey>n/a</attKey>
      <attRelType type="n/a" name="n/a"/>
      <attReferences>n/a</attReferences>
      <attListType>no</attListType>
      <attList/>
      <attNotes>n/a</attNotes>
      <attDefinition>What type of direction was used in defining plot aspect and other direction fields (such as bearing of the center line): based on magnetic or true bearings</attDefinition>
    <update>2.0.0</update></attribute>
    <attribute>
      <attID>8</attID>
      <attName>cust_cvs_CowardinSystem</attName>
      <attLabel>Cowardin System</attLabel>
      <attModel>logical</attModel>
      <attNulls>yes</attNulls>
      <attType>varchar (19)</attType>
      <attKey>n/a</attKey>
      <attRelType type="n/a" name="n/a"/>
      <attReferences>n/a</attReferences>
      <attListType>no</attListType>
      <attList/>
      <attNotes>n/a</attNotes>
      <attDefinition>terrestrial, palustrine, estuarine, riverine, lacustrine</attDefinition>
    <update>2.0.0</update></attribute>
    <attribute>
      <attID>9</attID>
      <attName>cust_cvs_GPSLocationX</attName>
      <attLabel>GPS Position within Plot (X)</attLabel>
      <attModel>logical</attModel>
      <attNulls>yes</attNulls>
      <attType>Float</attType>
      <attKey>n/a</attKey>
      <attRelType type="n/a" name="n/a"/>
      <attReferences>n/a</attReferences>
      <attListType>no</attListType>
      <attList/>
      <attNotes>n/a</attNotes>
      <attDefinition>X coordinate in plot where GPS was while recording position, in meters</attDefinition>
    <update>2.0.0</update></attribute>
    <attribute>
      <attID>10</attID>
      <attName>cust_cvs_GPSLocationY</attName>
      <attLabel>GPS Position within Plot (Y)</attLabel>
      <attModel>logical</attModel>
      <attNulls>yes</attNulls>
      <attType>Float</attType>
      <attKey>n/a</attKey>
      <attRelType type="n/a" name="n/a"/>
      <attReferences>n/a</attReferences>
      <attListType>no</attListType>
      <attList/>
      <attNotes>n/a</attNotes>
      <attDefinition>Y coordinate in plot where GPS was while recording position, in meters</attDefinition>
    <update>2.0.0</update></attribute>
    <attribute>
      <attID>11</attID>
      <attName>cust_cvs_LeafPhenology</attName>
      <attLabel>Leaf Phenology</attLabel>
      <attModel>logical</attModel>
      <attNulls>yes</attNulls>
      <attType>varchar (8)</attType>
      <attKey>n/a</attKey>
      <attRelType type="n/a" name="n/a"/>
      <attReferences>n/a</attReferences>
      <attListType>no</attListType>
      <attList/>
      <attNotes>n/a</attNotes>
      <attDefinition>comma list of EG=Evergreen, CD=Cold-deciduous, DD=Drought-deciduous, MC=Mixed evergreen-cold deciduous, MD=Mixed evergreen-drought deciduous</attDefinition>
    <update>2.0.0</update></attribute>
    <attribute>
      <attID>12</attID>
      <attName>cust_cvs_LeafType</attName>
      <attLabel>Leaf Type</attLabel>
      <attModel>logical</attModel>
      <attNulls>yes</attNulls>
      <attType>varchar (7)</attType>
      <attKey>n/a</attKey>
      <attRelType type="n/a" name="n/a"/>
      <attReferences>n/a</attReferences>
      <attListType>no</attListType>
      <attList/>
      <attNotes>n/a</attNotes>
      <attDefinition>comma list of B=Broad-leaved, N=Needle-leaved, M=Microphyllous, G=Graminoid, F=Forb, P=Pteridophyte</attDefinition>
    <update>2.0.0</update></attribute>
    <attribute>
      <attID>13</attID>
      <attName>cust_cvs_lengthSoilProbe</attName>
      <attLabel>Length of Soil Probe (cm)</attLabel>
      <attModel>logical</attModel>
      <attNulls>yes</attNulls>
      <attType>Float</attType>
      <attKey>n/a</attKey>
      <attRelType type="n/a" name="n/a"/>
      <attReferences>n/a</attReferences>
      <attListType>no</attListType>
      <attList/>
      <attNotes>n/a</attNotes>
      <attDefinition>Length of the soil Probe used to determine soil Depths in separate custom CVS table.  If depth equals or exceeds this value, then the depth is unknown, but is at least this deep.</attDefinition>
    <update>2.0.0</update></attribute>
    <attribute>
      <attID>14</attID>
      <attName>cust_cvs_LocationSource</attName>
      <attLabel>Location Source</attLabel>
      <attModel>logical</attModel>
      <attNulls>yes</attNulls>
      <attType>varchar (50)</attType>
      <attKey>n/a</attKey>
      <attRelType type="n/a" name="n/a"/>
      <attReferences>n/a</attReferences>
      <attListType>no</attListType>
      <attList/>
      <attNotes>n/a</attNotes>
      <attDefinition>How was the location of the plot determined (i.e. GPS, Topographic Map)</attDefinition>
    <update>2.0.0</update></attribute>
    <attribute>
      <attID>15</attID>
      <attName>cust_cvs_mcnab_LFI</attName>
      <attLabel>LFI average value</attLabel>
      <attModel>logical</attModel>
      <attNulls>yes</attNulls>
      <attType>Float</attType>
      <attKey>n/a</attKey>
      <attRelType type="n/a" name="n/a"/>
      <attReferences>n/a</attReferences>
      <attListType>no</attListType>
      <attList/>
      <attNotes>n/a</attNotes>
      <attDefinition>Calculated summary value of all LFI angle measurements</attDefinition>
    <update>2.0.0</update></attribute>
    <attribute>
      <attID>16</attID>
      <attName>cust_cvs_mcnab_LFI_135</attName>
      <attLabel>LFI at 135 deg</attLabel>
      <attModel>logical</attModel>
      <attNulls>yes</attNulls>
      <attType>Float</attType>
      <attKey>n/a</attKey>
      <attRelType type="n/a" name="n/a"/>
      <attReferences>n/a</attReferences>
      <attListType>no</attListType>
      <attList/>
      <attNotes>n/a</attNotes>
      <attDefinition>vertical angle to horizon, using the aspect+135 degrees as a bearing</attDefinition>
    <update>2.0.0</update></attribute>
    <attribute>
      <attID>17</attID>
      <attName>cust_cvs_mcnab_LFI_180</attName>
      <attLabel>LFI at 180 deg</attLabel>
      <attModel>logical</attModel>
      <attNulls>yes</attNulls>
      <attType>Float</attType>
      <attKey>n/a</attKey>